{
  "buckets": [
    {
      "bucket": "synonym",
      "language": "zh",
      "mrrAt10": 0.139286,
      "queryCount": 10,
      "recallAt10": 0.3,
      "recallAt5": 0.2
    },
    {
      "bucket": "synonym",
      "language": "en",
      "mrrAt10": 0.290952,
      "queryCount": 10,
      "recallAt10": 0.7,
      "recallAt5": 0.4
    },
    {
      "bucket": "exact",
      "language": "zh",
      "mrrAt10": 1,
      "queryCount": 3,
      "recallAt10": 1,
      "recallAt5": 1
    },
    {
      "bucket": "exact",
      "language": "en",
      "mrrAt10": 1,
      "queryCount": 3,
      "recallAt10": 1,
      "recallAt5": 1
    }
  ],
  "cases": [
    {
      "bucket": "synonym",
      "firstRelevantRank": 1,
      "forbiddenHits": [],
      "forbiddenIds": [
        "emb-forbidden-deleted"
      ],
      "id": "emb-q-synonym-zh-01",
      "language": "zh",
      "recallAt10": 1,
      "recallAt5": 1,
      "reciprocalRank": 1,
      "relevantIds": [
        "emb-zh-cinema"
      ],
      "returnedIds": [
        "emb-zh-cinema",
        "emb-en-flights",
        "emb-zh-agenda",
        "emb-en-bicycle",
        "emb-en-book-donation",
        "emb-en-photo-backup",
        "emb-zh-dairy",
        "emb-noise-zh-weekend",
        "emb-en-dog-command",
        "emb-zh-hotel"
      ],
      "split": "baseline"
    },
    {
      "bucket": "synonym",
      "firstRelevantRank": null,
      "forbiddenHits": [],
      "forbiddenIds": [],
      "id": "emb-q-synonym-zh-02",
      "language": "zh",
      "recallAt10": 0,
      "recallAt5": 0,
      "reciprocalRank": 0,
      "relevantIds": [
        "emb-zh-hotel"
      ],
      "returnedIds": [
        "emb-exact-en-locker",
        "emb-en-photo-backup",
        "emb-zh-dairy",
        "emb-exact-zh-passphrase",
        "emb-en-book-donation",
        "emb-en-flights",
        "emb-exact-en-dentist",
        "emb-en-bicycle",
        "emb-exact-en-checksum",
        "emb-en-dog-command"
      ],
      "split": "baseline"
    },
    {
      "bucket": "synonym",
      "firstRelevantRank": null,
      "forbiddenHits": [],
      "forbiddenIds": [],
      "id": "emb-q-synonym-zh-03",
      "language": "zh",
      "recallAt10": 0,
      "recallAt5": 0,
      "reciprocalRank": 0,
      "relevantIds": [
        "emb-zh-running"
      ],
      "returnedIds": [
        "emb-en-oatmeal",
        "emb-exact-zh-port",
        "emb-zh-standing",
        "emb-en-eink",
        "emb-zh-agenda",
        "emb-exact-zh-passport",
        "emb-exact-en-locker",
        "emb-en-book-donation",
        "emb-en-flights",
        "emb-en-photo-backup"
      ],
      "split": "baseline"
    },
    {
      "bucket": "synonym",
      "firstRelevantRank": null,
      "forbiddenHits": [],
      "forbiddenIds": [],
      "id": "emb-q-synonym-zh-04",
      "language": "zh",
      "recallAt10": 0,
      "recallAt5": 0,
      "reciprocalRank": 0,
      "relevantIds": [
        "emb-zh-dairy"
      ],
      "returnedIds": [
        "emb-en-eink",
        "emb-en-oatmeal",
        "emb-zh-running",
        "emb-noise-zh-river",
        "emb-zh-standing",
        "emb-zh-cat-medicine",
        "emb-en-code-review",
        "emb-en-bicycle",
        "emb-noise-en-apartment",
        "emb-noise-en-backup"
      ],
      "split": "baseline"
    },
    {
      "bucket": "synonym",
      "firstRelevantRank": null,
      "forbiddenHits": [],
      "forbiddenIds": [],
      "id": "emb-q-synonym-zh-05",
      "language": "zh",
      "recallAt10": 0,
      "recallAt5": 0,
      "reciprocalRank": 0,
      "relevantIds": [
        "emb-zh-agenda"
      ],
      "returnedIds": [
        "emb-zh-hotel",
        "emb-zh-cinema",
        "emb-noise-zh-weekend",
        "emb-zh-running",
        "emb-en-code-review"
      ],
      "split": "baseline"
    },
    {
      "bucket": "synonym",
      "firstRelevantRank": null,
      "forbiddenHits": [],
      "forbiddenIds": [],
      "id": "emb-q-synonym-zh-06",
      "language": "zh",
      "recallAt10": 0,
      "recallAt5": 0,
      "reciprocalRank": 0,
      "relevantIds": [
        "emb-zh-detergent"
      ],
      "returnedIds": [
        "emb-zh-cat-medicine",
        "emb-en-book-donation",
        "emb-en-eink",
        "emb-en-thermostat",
        "emb-noise-zh-weekend",
        "emb-en-oatmeal",
        "emb-exact-zh-passport",
        "emb-en-photo-backup",
        "emb-exact-en-dentist",
        "emb-noise-en-weekend"
      ],
      "split": "holdout"
    },
    {
      "bucket": "synonym",
      "firstRelevantRank": 7,
      "forbiddenHits": [],
      "forbiddenIds": [],
      "id": "emb-q-synonym-zh-07",
      "language": "zh",
      "recallAt10": 1,
      "recallAt5": 0,
      "reciprocalRank": 0.142857,
      "relevantIds": [
        "emb-zh-harbin"
      ],
      "returnedIds": [
        "emb-zh-dairy",
        "emb-noise-en-apartment",
        "emb-noise-en-backup",
        "emb-en-code-review",
        "emb-en-thermostat",
        "emb-zh-running",
        "emb-zh-harbin",
        "emb-zh-standing",
        "emb-zh-cat-medicine",
        "emb-exact-en-dentist"
      ],
      "split": "holdout"
    },
    {
      "bucket": "synonym",
      "firstRelevantRank": null,
      "forbiddenHits": [],
      "forbiddenIds": [],
      "id": "emb-q-synonym-zh-08",
      "language": "zh",
      "recallAt10": 0,
      "recallAt5": 0,
      "reciprocalRank": 0,
      "relevantIds": [
        "emb-zh-standing"
      ],
      "returnedIds": [
        "emb-en-bicycle",
        "emb-exact-en-locker",
        "emb-en-flights",
        "emb-en-oatmeal",
        "emb-en-thermostat",
        "emb-noise-zh-weekend",
        "emb-zh-cat-medicine",
        "emb-zh-emergency-contact",
        "emb-noise-en-backup",
        "emb-zh-agenda"
      ],
      "split": "holdout"
    },
    {
      "bucket": "synonym",
      "firstRelevantRank": null,
      "forbiddenHits": [],
      "forbiddenIds": [],
      "id": "emb-q-synonym-zh-09",
      "language": "zh",
      "recallAt10": 0,
      "recallAt5": 0,
      "reciprocalRank": 0,
      "relevantIds": [
        "emb-zh-cat-medicine"
      ],
      "returnedIds": [
        "emb-en-thermostat",
        "emb-exact-en-dentist",
        "emb-exact-en-checksum",
        "emb-zh-harbin",
        "emb-zh-emergency-contact",
        "emb-exact-zh-passphrase",
        "emb-zh-detergent",
        "emb-noise-en-apartment",
        "emb-noise-en-weekend",
        "emb-en-flights"
      ],
      "split": "holdout"
    },
    {
      "bucket": "synonym",
      "firstRelevantRank": 4,
      "forbiddenHits": [],
      "forbiddenIds": [],
      "id": "emb-q-synonym-zh-10",
      "language": "zh",
      "recallAt10": 1,
      "recallAt5": 1,
      "reciprocalRank": 0.25,
      "relevantIds": [
        "emb-zh-emergency-contact"
      ],
      "returnedIds": [
        "emb-zh-cinema",
        "emb-zh-cat-medicine",
        "emb-noise-zh-weekend",
        "emb-zh-emergency-contact",
        "emb-en-book-donation",
        "emb-en-thermostat",
        "emb-exact-en-locker"
      ],
      "split": "holdout"
    },
    {
      "bucket": "synonym",
      "firstRelevantRank": 2,
      "forbiddenHits": [],
      "forbiddenIds": [
        "emb-forbidden-cross-owner"
      ],
      "id": "emb-q-synonym-en-01",
      "language": "en",
      "recallAt10": 1,
      "recallAt5": 1,
      "reciprocalRank": 0.5,
      "relevantIds": [
        "emb-en-bicycle"
      ],
      "returnedIds": [
        "emb-en-code-review",
        "emb-en-bicycle",
        "emb-en-oatmeal",
        "emb-en-emergency-fund",
        "emb-en-dog-command",
        "emb-exact-en-checksum",
        "emb-en-photo-backup",
        "emb-exact-en-locker",
        "emb-en-book-donation",
        "emb-en-thermostat"
      ],
      "split": "baseline"
    },
    {
      "bucket": "synonym",
      "firstRelevantRank": 1,
      "forbiddenHits": [],
      "forbiddenIds": [
        "emb-forbidden-source-only"
      ],
      "id": "emb-q-synonym-en-02",
      "language": "en",
      "recallAt10": 1,
      "recallAt5": 1,
      "reciprocalRank": 1,
      "relevantIds": [
        "emb-en-oatmeal"
      ],
      "returnedIds": [
        "emb-en-oatmeal",
        "emb-en-thermostat",
        "emb-en-bicycle",
        "emb-zh-emergency-contact",
        "emb-noise-en-weekend",
        "emb-en-dog-command",
        "emb-en-eink",
        "emb-en-code-review",
        "emb-noise-en-backup",
        "emb-exact-en-checksum"
      ],
      "split": "baseline"
    },
    {
      "bucket": "synonym",
      "firstRelevantRank": 2,
      "forbiddenHits": [],
      "forbiddenIds": [],
      "id": "emb-q-synonym-en-03",
      "language": "en",
      "recallAt10": 1,
      "recallAt5": 1,
      "reciprocalRank": 0.5,
      "relevantIds": [
        "emb-en-thermostat"
      ],
      "returnedIds": [
        "emb-en-code-review",
        "emb-en-thermostat",
        "emb-exact-en-locker",
        "emb-exact-en-checksum",
        "emb-en-eink",
        "emb-exact-en-dentist",
        "emb-en-emergency-fund",
        "emb-en-oatmeal",
        "emb-noise-en-apartment",
        "emb-noise-en-weekend"
      ],
      "split": "baseline"
    },
    {
      "bucket": "synonym",
      "firstRelevantRank": null,
      "forbiddenHits": [],
      "forbiddenIds": [],
      "id": "emb-q-synonym-en-04",
      "language": "en",
      "recallAt10": 0,
      "recallAt5": 0,
      "reciprocalRank": 0,
      "relevantIds": [
        "emb-en-flights"
      ],
      "returnedIds": [
        "emb-noise-en-apartment",
        "emb-en-eink",
        "emb-en-book-donation",
        "emb-en-emergency-fund",
        "emb-noise-en-backup",
        "emb-en-photo-backup",
        "emb-en-thermostat",
        "emb-en-code-review",
        "emb-en-dog-command",
        "emb-en-oatmeal"
      ],
      "split": "baseline"
    },
    {
      "bucket": "synonym",
      "firstRelevantRank": 6,
      "forbiddenHits": [],
      "forbiddenIds": [],